ID Receta,Titulo,Calorias,Carbohidratos,Proteinas,Grasas
Cdd6uX6fxnchC7gmerft,Mocktail de Pepino y Albahaca,5,2,0,0
NMVC5c0e3RgaXo8p6qLg,Agua de Pepino y Limón,5,1,0,0
aEvNkjyplVSIPYKQGIeh,Agua de Sandía y Romero,5,1,0,0
eZwvyunb89iOTIcY4RH1,"Agua con Gas, Fresa y Menta",5,2,0,0
D5ezwv1RpCMui31jhLLV,Soda Italiana de Crema de Naranja,10,2,0,0
dwstYDM5xFx8qy7tejOO,Agua de Piña y Menta,10,2,0,0
03duuZrboNXwfRC0MBD6,Dip de Yogur con Espinaca,15,1,2,0
4owcXBQ1af4u50Wyz3o6,Salsa Casi Suave,15,1,0,1
RNlYga9fV9KxgEjFKoux,Crema de Pesto de Albahaca,15,1,2,0
VUchTzv4yzzbNtNkHR7D,Salsa de Piña Asada,15,3,0,0
f2lNd3DvZV7Wqc5nxG2o,Ensalada de Pepino y Cebolla,15,3,0,0
pJMfeqSsQSBng2xiJ7Co,Pepinillos sin Azúcar y Bajos en Sodio,15,4,0,0
6u1PV1gwGG283i71JhVo,Coles de Bruselas en Escabeche,20,4,1,0
6v5njhixkf8Ecfi4R99w,Tzatziki y Verduras,20,3,1,0
yBEQK32vDpNCQ3XqjFtT,"Fresas con Glaseado de Balsámico, Pimienta Negra y Estragón",20,5,0,0
6sXjVjYRPelAVVFWGMze,Tomates Cherry Rellenos de Guacamole,25,2,1,2
LqDD6KTrLwB5DGec1ss8,Brochetas Caprese,25,1,1,2
fj0MvhIgNmkxm5mybAzo,Salsa para Mojar para Mini Pasteles de Cangrejo al Horno,25,6,0,0
uI6nWIxaOXqwRGN99QUb,Granizado de Sandía y Lima,25,7,1,0
vMv2vPWsyRL5T2rXOsQh,Salsa de Frijoles Negros y Durazno,25,4,1,0
TMG7iIh3KxFPYUp7WcvM,Salsa de Frutas del Bosque,30,5,0,1
aKerNxBZ4NEUH9OGCR8K,Coliflor Asada Simple,30,2,1,2
YSwvJDW556SZNZhnZPb1,Salsa de Arándanos,35,7,0,1
nhECSHHJ8LNOAzmL5Eiw,"Dip de Cebolla, Espinaca y Alcachofa",35,3,1,2
xXVOxr0nG6aLNLY7cCbR,Dip de Frijoles con Hierbas,35,7,2,0
K7oyBc9xBZdvo08R0uBj,Sorbete de Piña y Durazno,40,10,1,0
SivyHSj0Vtmd3xuDKAwS,Dip de Espinaca y Alcachofa,40,3,2,1
TcN5AQqRSVS44lsmXnrw,"Dip de Cebolla Dulce, Frijoles Blancos y Alcachofa",40,5,2,1
g34kIBlWU71hviFTTULn,Salsa de Mango y Tomate,40,8,1,1
gGchoEYFslKVm7NcBAhj,Bastones de Apio con Hummus y Pimiento Rojo,40,4,2,2
iCofkPTA8CmBz9uE1zeM,Hummus de Remolacha Asada al Curry,40,4,1,2
mA9iybtYIFx9HxLTCOMZ,Cestas de Batata con Huevos,40,6,4,0
vuOtyxF9kgNYIAXIDT6F,Lassi de Papaya,40,6,4,0
3lMqbO8e8euKO7kEJw6D,Pimientos Rellenos,45,4,3,1
B44utUPbfzBUDS5NpDQn,Dip de Taco Saludable,45,4,3,2
EJy80yKx0Ktbkh4lbk8f,Guacamole de Pepino,45,4,1,3
bgFxfAiMnrp8WU7W7xJY,Huevos Rellenos,45,1,3,3
0VOG7YtI228EibdHhP7X,Pasteles Salados de Coliflor y Queso,50,3,6,2
8tGToYaCOUuxSKqfkoHZ,Champiñones Rellenos de Bruschetta,50,4,4,3
BFJbK4JUMTgq2gaq6gM1,Garbanzos BBQ Asados,50,6,2,2
CWntB2AnvFugPX68PHqX,Chips de Manzana al Horno,50,13,0,0
Jr5KXzLJtRN5okEJ9GYR,Pimientos Jalapeño Rellenos envueltos en Tocino de Pavo,50,3,3,3
LEyNCOT9OVhteK1ochGb,Bocaditos de Huevo con Espinaca y Parmesano,50,3,6,1
b3yKCwiNqJbTw9vf5ahY,Pastelitos de Alcachofa,50,4,3,2
iW1Lr4rSXZI2WYDPu01e,Champiñones Rellenos,50,3,4,3
D6I58pCOqji0WIIOAiYL,Mini Frittatas de Verduras,55,1,6,3
qB3kILVj6lGya6v3ot8m,Paletas de Yogur y Frutas Congeladas,55,5,2,3
x19JMcBFpsadzkTwHmSc,Dip de Aguacate y Pepino,55,3,2,3
nQKJ1TPFJserQG9QnHp7,Crujientes de Pita con Ajo,56,12,2,1
3708WncuMh5TOEDjn3Jm,Ensalada de Aceitunas Sicilianas,60,3,0,6
4Fnj6Qopy6ZWikMcOa22,Judías Verdes Picantes en Freidora de Aire,60,7,2,3
5sMwu5TUBF2vYsPuktky,Okra en Sartén con Tomate y Cebolla Dulce,60,10,2,2
BHKkebGhNWTy9UBKcv6I,Spritzer de Fresa y Kiwi,60,13,1,0
Dymw7Ctce8bASYDAuseG,Dip de Frijoles Caribeño,60,9,3,2
FHPsbD2bxur2u8iM0iqz,Tapioca de Almendra con Banana y Maíz,60,12,1,2
OC46tRgwg74rtDQaivNq,Muffins de Huevo Fáciles,60,1,6,3
WEp0jpLhPQRAZr2wQHWq,Mini Quiche sin Corteza de Espárragos y Pimientos,60,4,5,3
nx4k15mSjIUZxky1qGhz,Maduros al Horno (Plátanos Dulces),60,15,0,0
pjMiennANubb1fJRvmvW,Bruschetta de Salsa de Mandarina y Prosciutto,60,10,3,1
tEaCmBj0BQDpwr9AAypb,Frutas del Bosque Mezcladas,64,15,1,0
3LJasE8kAoexdV7tD0v4,Camarones al Ajo en una Flor de Pepino,65,2,7,3
5Kj7sbnOjsNeoBx5qmtP,Ceviche de Camarones,65,5,4,0
C6Dvc1jpNwQXkZAhMAQC,Barras de Proteína de Calabaza y Manzana,65,9,4,2
EB4DiSsqFavuJdWPjefD,Mini Bocaditos de Cangrejo - Receta Rápida,65,5,5,3
Yl3qvRvPNwmvcLhkNfVF,Flanes Salados de Espárragos,65,5,10,1
aWzgGmqHLoiXiKN4TYQB,Galletas de Parmesano sin Gluten,65,7,2,3
0kMG1QyH9Nfey5FRJnn4,"Frittata de Cebolla, Chalota y Hierbas",70,4,6,4
29Lyrzde34LfX03IQj3n,Bocaditos de Avena con Mantequilla de Cacahuate y Banana,70,7,3,4
2bJJUaVIzXVeNTOk0NO9,Kale Asiático Crujiente,70,9,4,3
7K1u2ERzvw78H4XnDxDa,Batidos de Yogur con Fresa,70,6,8,1
8Mo8CXC5A73qW39G2HJJ,Paletas de Batido de Frambuesa para Niños,70,13,3,0
9C1BW6dH4BGHp0wnRaCq,Pan de Soda Irlandés de Trigo Integral,70,15,3,0
9mUC4qbz3BcKGUQGWu0a,Bastones de Apio con Almendra y Arándanos,70,6,2,4
BRGBnUm0vAQ5oKnJ3ZUX,Tira de Yogur Congelado con Remolino de Frambuesa,70,18,8,1
Lv76dnbMgYIeJEcld1fy,Ensalada de Huevo Fácil,70,2,5,4
QBHaFmH5hKgMK4ukZdEi,Hummus de Frijoles Negros,70,8,3,3
T9R7TQmOszrsThy4d7sh,Galletas de Lino con Romero Bajos en Carbohidratos,70,4,3,5
V5WtQR0asj7wqGiYSakL,Pasteles de Verduras de Raíz,70,13,3,0
a0Q4h29MlMklDgajHVvL,Galletas de Mezcla de Frutos Secos con Chispas de Chocolate y Cerezas,70,12,2,3
bI67Vmsiw0sUZyEM5TgE,Manzanas con Jarabe de Maple,70,14,1,2
dQLnQJdDgNA7FZJ2R38Q,Yogur Griego Congelado con Limón y Tomillo,70,6,11,0
n4bJz1g9BcjHR6Z8rFqz,Hummus de Masa de Galleta,70,9,3,3
pZtc9X0zf0Wdqx1DsDoz,Dip de Ricotta con Perejil y Eneldo,70,4,5,4
5XomtNn2qMARi2L7gjtw,Zanahorias Baby y Dip de Crema Picante,73,10,3,2
DDjMBe6JshZGMHbeUCPS,Huevos Endiablados con Mostaza de Dijon y Rábano Picante,75,3,7,4
E0IrSDRD4YonXUVdr04x,Salsa de Tomate y Pimiento Rojo Asado,75,3,1,7
KgTSlssTWt6J7slqJNGd,"Huevo al Horno con Espinaca, Tomate y Queso Feta",75,1,7,4
hiLjsh0OTTsnFUTVEOXJ,Alitas BBQ Sin Hueso,75,8,8,1
qfgWHAdCjGm8qPYo1UOj,Manzana con Canela y Jengibre en Palito,75,13,1,3
7gRdvrPWzKv4lJyXafBN,Huevo Duro,78,0,6,5
6zuu2MteAyYZ3HSa2DNg,Pizza Margherita (Pan de Nube),80,4,4,6
ABjawqh9EP902TPRbj8s,Alitas de Coliflor BBQ con Miel en Freidora de Aire,80,16,4,1
MhhCvoZxRWgi2PlGV202,Helado de Banana y Chocolate,80,18,2,0
PRhljk2z87zfleEnVTjP,Bocaditos de Salmón Ahumado y Pepino,80,3,5,5
bbbEla9fFOGuUpk1vDyn,Bocaditos de Mantequilla de Cacahuate y Chocolate sin Hornear,80,9,2,3
ip6rHirRxLejyDkqRWDh,Ensalada de Invierno con Cítricos,80,10,2,4
ljPaUJ1jb8toDZu7RYKX,Brochetas de Frutas y Queso,80,12,5,2
mM9giDAajWzNRF9uha6x,Rollitos de Primavera de Verduras con Salsa de Cacahuate,80,9,3,4
sjpW5RGOH6OsWqPY2fNS,Dip de Queso Rápido y Fácil,80,3,4,5
ux6gioGkdywis47dEEGW,"Tazas de Huevo, Champiñones, Espinaca y Jamón",80,1,8,5
AwcJjMXgW28oN4zWNHKg,"Gazpacho 2,2,2 Bueno",85,19,4,0
HBPMufcZvj5LPuJNpLjx,Dip de Pollo al Estilo Buffalo,85,2,6,6
j9xqOi13ddBjFaqLqfMU,Huevos al Horno Dulces y Ahumados,85,4,7,4
kXPK5My35GpJt2lVtEuq,Pudín de Calabaza y Vainilla,85,9,3,4
0v2MNBW0Nm7p3WTBBfnV,Tazas de Dip de Verduras,90,10,5,4
9T9YPtxdK9nPbiLfNdI8,Lentejas Marroquíes con Tomates Guisados,90,16,6,0
CmtkjxbRlfleiglRDzsk,Chips de Kale con Cinco Especias Chinas,90,6,3,8
ZbBkOsyoMeFaAv9imNck,Tazas de Calabaza Espagueti de Un Bocado,90,7,1,6
fmZECPKFRlbDyqS8y4vV,Barras de Yogur con Arándanos y Limón,90,10,4,4
j2f2MFQesbP1kZRI7gIx,Frutas del Bosque y Crema,90,19,2,1
jSUyQw23rQjAMl1eO7oY,Tartitas Mini de Pera y Queso de Cabra,90,11,3,4
lAg2iFIlKX2McXyyua4C,Wraps de Salmón y Rúcula,90,10,9,3
mBXP38WxdQy2ZOuFmp3M,Huevos Endiablados con Hummus,90,10,7,2
yWzf9l0cotY1PRjVXqRx,Bistecs de Repollo Asados,90,9,2,5
E8OzB8UYP4r4m8klPirl,Tabbouleh de Garbanzo,95,12,3,4
12thgTyUWtsghfOneczJ,Frittata de Espárragos,100,4,12,4
4YPOLNUgJoolzcqUNYM5,Omelet de Verduras,100,7,9,5
7GY7wPcWjx9lIucKUcck,Enfriadores de Melón,100,24,2,0
7o6RalNTDUinI0p7NcUS,Batido de Aguacate Marroquí,100,11,1,6
7vIwnNyIqsNgpdiY6Q47,Mini Muffins de Banana y Chispas de Chocolate,100,19,4,2
8mTxIHOtmlPBSKORS8QR,Pasteles de Salchicha de Desayuno Saludables,100,1,12,4
DSpLVmrDKhq3GkxTDoP5,Batido de Frutas y Almendra,100,15,5,2
E8HSKyH78C3g9pnAmFop,Pizza de Champiñones y Rúcula,100,14,6,4
IN260gL5LlS0yyg8F2M1,Puré de Patatas Rojas,100,19,3,1
NoLLyzsAmN7u9wFwLmMn,Empanadas de Phyllo de Maíz y Queso,100,14,4,4
SDDX3wjEhHED6KReSjze,Brochetas de Res con Lemongrass al Estilo Tailandés,100,1,14,4
W8meTI8f1C79uw2m5XMG,Panqueques de Banana Doble,100,23,3,0
eVnRjZ9mQCMQ53JFoI6B,Tostadas Francesas Rellenas de Fresa,100,10,6,5
ivyODIYuU4VqJnvgz80y,Ensalada de Frutas con Yogur de Miel,100,20,5,0
oXgp4xTo6ZB0Kg3AYer8,Bocaditos de Brócoli y Queso,100,13,7,3
pwS3fEar7n2RmDDcFGID,Hummus de Pesto con Limón,100,14,5,3
ucTgFiV6o9OYwANIoiJq,Ensalada de Huevo sin Mayonesa,100,3,13,2
xvShFOpwr2YSSQtlP8sI,Ensalada de Kale y Manzana,100,13,5,4
ydzXdYyzRBv0CcBUkZE8,Bombas de Panqueque Rellenas de Frutas,100,10,5,5
8DQbwVK2020mz3jCyfxI,Fu Yung de Huevo y Verduras,105,12,8,2
BL2A09m7yarIH8fmwKLj,Quiche de Calabaza con Corteza de Quinoa,105,14,6,3
CEoiBtWsziQFF2Tc5zN3,Chocolate Caliente Almond Joy,105,11,3,7
U34w74aTgQOAVD66nSrh,Plato de Verduras Festivo con Hummus – Receta Rápida,105,11,4,5
3KfznsmSLu7FTaiUv9gu,"Bulgur, Menta y Tomates sobre Rodajas de Pepino",110,15,3,5
Ch6AuLdetfcBXF58KJPE,Hummus de Calabaza,110,13,4,5
JcXRHORxbj8WW09LJezr,Brochetas de Aperitivo de Pavo y Mozzarella,110,4,9,7
O3R1UyQtXVdOZs9U0Ypw,Cuadrados de Snack de Pan de Calabacín con Chocolate Negro,110,16,3,5
Oliul6xh7ZDjBAs0Kmyc,Granola Casera Endulzada con Frutas,110,14,4,5
QS29lAPVIu837n7Mc6Wl,Tazas de Desayuno para Amantes de la Carne,110,9,8,5
R2ttX8sqkKIxRzXTKrvJ,Mix de Camino con Curry de Coco,110,5,4,9
XvGlKnjg9CJLBj5MrZiZ,Cazuela de Salchicha de Pavo y Huevo,110,8,13,2
aR0HZHvp7XWN2exaOSXT,Ensalada de Atún con Garbanzos,110,8,12,3
e9732lMpzNg4Pb7rITRD,Frittata de Cebolla Dulce con Jamón,110,6,17,2
f4nWtPPbCiHB8x0VRQgX,Sopa de Tomate y Albahaca Italiana,110,22,4,2
iV9aW8Ld9xpzgkRq51kZ,Ensalada de Frijoles Negros y Maíz,110,16,4,4
ik1596fG0KqQhAQBAu2o,"Bolas de Dátiles, Almendra y Sésamo",110,12,3,7
m4baSMl6OJy1Aa7socui,Mix de Snack con Clúster de Semillas de Calabaza,110,19,3,4
s2mWW1RVnsl0nAdPyq7O,Pizzas de Muffin Inglés con Espinaca y Jamón,110,17,9,3
5yroRF0rKEIJvX2E2b6J,Champiñones Rellenos de Salchicha,115,17,6,3
Ynvcdh0LLQtZq4eWdW0T,Cheesecake de Fresa y Limón,115,17,11,0
08txtNEQcBRb7tWYdHnW,Salsa de Pera Asada,120,20,1,6
28e8xikJaYNQwG1TwmCI,"Dip de Frijoles Blancos, Limón y Feta con Hierbas",120,9,4,8
BV9TKGs2Ye6kQpXz5D59,Pudín de Semillas de Chía con Limón y Frambuesa,120,18,3,5
Fo7ynk1XOLZ0KSV1WOAR,Panqueques de Salvado de Avena,120,23,7,2
Hi2iOsPFFQe38eds0AtT,Garbanzos Asados y Especiados,120,15,4,6
SUjFfNwKZMN9tT8sev6l,Cazuela de Huevo y Verduras,120,7,10,6
Z1dykkrNKwBtZfPx4362,Galletas de Avena con Maple y Especias de Calabaza,120,16,2,6
bEMPv8SXodaeJzkwqHO4,Wrap de Desayuno con Verduras,120,8,9,6
lLkqN36Cth1xJI7cYZnA,Crostini de Ricotta y Mermelada de Mora,120,18,5,3
nyBTDbWy9ghX5vFb9fBS,Dip Dulce de Mantequilla de Cacahuate,120,22,3,1
wGSbJqp7yiIycqOgepcS,Batido de Superalimentos,120,26,2,2
xkF2RQyI7AYAEnmhYYUP,Falooda de Semillas de Chía,120,15,5,5
A26UF56q1EQ8uqzCbX47,Muffins de Salvado de Avena,121,20,4,4
IXdmOgxwUZAvLQYx15yz,Sopa Rápida de Hierbas y Tomate,125,16,4,6
sUP85kps6qIlxKEudK0G,Panqueques de Batata y Trigo Integral,125,22,8,1
3ZkrhulX7sksrpUkrXc2,Omelets del Mercado de Agricultores,130,6,12,6
6N01ymXHGWEywzqKUKqe,Ensalada de Atún y Aguacate,130,4,18,5
6aUW2iuTTorXYSOOZ2vR,Camarones al Limón (Gamberi Al Limone),130,1,18,3
7wQo6W84CpfgJOPdUsIG,Tartas de Yogur con Higo y Nuez,130,14,4,7
ByFOeBhfDjbbHWcUc3jG,Barras de Granola con Frutas y Nueces,130,18,4,8
DuTSm0vQT7mmBXHLZZZ7,Chips de Manzana con Canela y Dip de Yogur con Mantequilla de Cacahuate,130,13,5,7
FWG7lI4McL20z7vZSicq,Mousse de Chocolate con Yogur Griego,130,17,9,4
Ld61a8Knj8UvxT92mVgi,Frittata de Verduras de Verano Económica,130,9,11,6
McKM3Yb8JiQb5CuLQAgy,Panqueques de Avena y Pacanas,130,13,5,7
TZvyEjVQPU2suhlD5WAD,Bolas de Proteína sin Hornear,130,7,7,9
c99ZlNKZzW1KMe83vDDD,Parathas de Espinaca y Trigo Integral,130,25,3,2
dsVqHYRaeFF3UWli4MQM,Palomitas de Maíz BBQ,130,18,3,6
hsEOWNdxhZm4BFwOdqey,Helado Saludable de Almendra y Chocolate Negro,130,23,4,5
lFrz7I9Vh3M1xIkUnsTB,Batido de Chocolate y Cerezas,130,18,10,3
uPHIQM6lmrDORpZ6BWAM,Tazas de Huevo y Tomate al Horno,130,7,10,7
zULMqE9UAg2PW83OwYAa,Hamburguesa de Proteína en Lata,130,8,11,7
GuWoxIXw03nNUlCmbQRw,Soufflé de Huevo,135,6,20,3
Hh8FqNu2Pa8xzEyaAZa3,Bruschetta de Lentejas,135,23,6,2
08zODncmnAXDn4C9Ad8m,Muffins de Proteína con Arándanos y 5 Ingredientes,140,14,5,7
0loS9vW6KioAsACpjNZp,Pan de Banana sin Gluten,140,25,4,3
3dPFdaNzgJOp3mvCDdtW,Quiche Mediterránea sin Corteza,140,7,8,8
5FGVJMrBFFbn8VwpMi9o,Hamburguesa Básica de Frijoles,140,24,7,1
7DedxDEYxKdINY0w5N8h,Muffins de Calabaza y Banana,140,20,3,6
7GN2XkLWOXVqLTMRocK7,Arroz Integral Simple con Cebolletas,140,25,3,3
E3FGaeZ7M99TSS5hEHv3,Desayuno Grande en Sartén,140,7,12,8
FXT9weKEfY4bkcqWxaRa,Batido de Durazno y Crema,140,19,9,5
JIZBTsQB30oGSFhJlTHd,"Pudín Energético de Cacao y Menta, a Base de Plantas",140,28,5,2
LmPLXkdvzPe6EgCVZcl6,Batido de Frutas de Verano,140,22,5,5
OWEh20igTtIvH4Mk9Wx5,"Rebanadas de Manzana con Mantequilla de Cacahuate, Arándanos y Nuez",140,13,3,9
SJhEfG6E2xVmzJBZM4Db,Rollitos de Primavera de Tofu,140,20,7,5
U0t6zvqGLXPr3GNQ8nPt,Camarones a la Parrilla con Cítricos y Verduras de Primavera,140,13,8,7
b032rJsDBns6jsg99HtR,Mini Muffins de Maíz y Arándanos sin Gluten,140,26,3,3
qKLCRQg4ojCR5RUIwQkV,Frijoles Negros y Tomates con Lima,140,15,5,7
z4QPLihhHs5zmUwd2UOJ,Barras de Granola de Mantequilla de Cacahuate y Mermelada,140,17,5,7
xiNm2rs0raV8RuAJG5bi,Parfait Energético de Buenos Días,142,30,6,1
8Byr5u4sR72RDIA6Jlm7,Muffins de Calabacín y Dátiles,145,21,4,5
56CXIM9p9udSdyWfJIwy,Pudín de Chía con Chocolate,150,29,7,8
5wdNYa93AgO9LALWMeo8,Rollitos de Lechuga con Salsa de Frijoles Negros y Mango,150,27,6,3
Fb7FjYr5IsNxGY00OR2q,Muffins de Pastel de Carne con Cobertura de Batata,150,15,11,5
QejKekZi8X4GMVICEtbT,Quiche sin Corteza de Espárragos y Tomate,150,10,15,5
TFufahoBjpHfvWSAAxOc,Congee de Arroz Integral con Hierbas Salteadas,150,27,3,3
ipnyP8CFWOpDBjk56xwi,Mini Tarta de Durazno,150,20,2,8
iqUctdKCuwJ2foY9Um1S,Manzanas al Horno Dulces y Saladas,150,17,4,8
krzQKC8Xs1OLPcwXFiBJ,Salsa de Durazno y Frijoles Negros con Chips,150,22,4,6
l3RGoDlOPbGgABHxA4CN,Ceviche de Atún,150,16,13,4
uGyoizmuGObeBmscmumQ,Tazas de Huevo Crujientes en Freidora de Aire,150,6,12,8
xDhaVuVzrg7EMCqoquWk,Blondies de Mantequilla de Cacahuate con Cacao Nibs,150,15,3,10
zjP2rsu8v2SKYDKdetBC,Caviar Vaquero,150,25,8,2
4vMbcgSfMPCSNuc4NIXS,Frijoles y Verduras en Sartén en Tres Minutos,155,21,8,6
p0ZG9RV0PnOkZLIE1oM1,Receta Rápida de Ensalada de Garbanzo,155,19,5,7
3sEYzETn8EQfWc7JpuFM,Quesadilla de Desayuno,160,8,14,10
4G2S9fbfmr93D70P9t9f,"Batido de Almendra, Arándanos Silvestres y Linaza",160,21,5,8
BwFX6FgtH5aXzeNJKiuK,Cazuela de Huevo Mexicana en Sartén,160,9,13,9
IlanZvqc1vLQnCENc3Af,Aguacate Relleno de 4 Capas,160,12,5,12
NXn3ciZfZys7uqZjZuay,Frittata de Tomate y Albahaca,160,17,12,5
OlMqioQA61Bik7L9z0Bb,Casamiento de Quinoa y Frijoles de Ingrid Hoffmann,160,26,7,3
RDLnFmvbrfLgB563h9zD,Mix de Camino con Nueces Tostadas y Arándanos,160,8,5,13
S3IQqdWyekDmpwGdkgd1,Lomo de Cerdo con Ajo y Sésamo,160,1,23,6
SM4RzL5xP51c70DA3RQe,Huevos Rancheros,160,15,10,7
V6sKF9QKJ3va8awNmAMs,Barcos de Huevo con Calabacín,160,8,15,8
XyFUVamR8F8d1NPHkJYi,Granola de Otoño con Semillas de Calabaza,160,23,4,6
d2lyCS6Uc1F6XSENBlt5,Anillos de Galletas Integrales con Pimienta Negra y Semillas de Hinojo (Taralli Integrali con Pepe e Finocchio),160,23,5,6
iD2st9fhR78bVcjPV7Dt,Huevos Benedict Florentino,160,16,11,8
sCWT5Uyn3SeuGXTcAw7I,Ensalada Deliciosa de Aguacate y Fresa con Piñones Tostados,160,14,2,12
t3c50ASB7BCUi3jty78s,Shakshuka,160,10,9,10
tkj5wopKOdRzoM3QxmKI,Salsa Fresca de Frijoles Negros,160,22,4,6
0ZLZCljMdw7qM9znxlNL,Pan de Jengibre Fresco de Trigo Integral,170,27,4,6
CDyyJAh1UxC3Ol6gJeje,Pitas de Queso y Verduras,170,23,8,6
FXwAluLFWyQWc10iIxxI,Pasteles de Quinoa,170,28,10,2
PA8SEm70DqytzkSkSyDf,Huevos Revueltos Suaves con Hierbas sobre Tostada,170,16,11,8
PDX6zyFMBVp3ZACFHQ1X,Salteado Económico de Col Rizada y Salchicha,170,17,14,6
SeQ0IFRb9dE2M4oNBkAv,Frittata de Jamón y Brócoli,170,14,15,6
ZQvyUDJXHGAXfaPMTpOC,Crepes de Chía y Frutas del Bosque en Instant Pot,170,28,8,3
ce1Lu2DPSHByZrfCeC1t,Pizzas de Desayuno de Trigo Integral,170,20,14,4
ltftc2MqGzGFUKpr4oQW,Quiche de Desayuno del Suroeste,170,10,16,7
ohgGulF2iYeMrjgAAAUW,Sopa Mexicana de Frijoles Negros,170,15,20,3
p03XClVCs2HrKkK7KyOC,"Socca con Huevos Escalfados, Tomates Asados y Albahaca Fresca",170,9,9,11
qdYqzAfDBTn3dYzGB9hW,Pastel de Proteína de Caramelo,170,16,6,10
ubStRVfbJoSjw3ytccZx,Pollo Teriyaki al Horno,170,3,30,3
TXjFPxphYZCh6DvwdfjT,Mix de Snack Saludable - Receta de Foodie,175,9,6,14
ee31zxoPuQOEyYoQQeui,Congee de Avena,175,19,10,6
4BCgKq47V449Ee31bQ7N,Chili de Verduras,179,33,9,3
07hqNaI8OzH25WLONLv1,Salteado Simple de Pollo,180,9,18,8
ITE9ompmxjvnafGb1NRj,Tazón de Desayuno con Puré de Batata,180,24,9,6
JkloGvxPZ3G5mZEEJ5Jd,Frutos Secos Mezclados Glaseados,180,5,5,18
KHad38jVxYJUrQVn5Fol,Tostadas de Rábano con Queso de Cabra y Cebollín,180,19,11,7
UR0FLgwQQPX12GcmMJ1H,Ensalada de Durazno y Maíz de Verano,180,33,5,6
cRke417wPGNbvaLqZoJZ,Quinoa Roja y Farro,180,28,5,5
ckAsxliBb8tnCL4X7wke,Parfait de Yogur sin Azúcar con Frutas Frescas,180,19,24,1
e1D5H1OW49p6XYubJaxd,Calabaza Espagueti Asiática en Instant Pot,180,21,10,8
f6Q1RTpCxzbfsjxqh2I5,Mini Frittata de Verduras,180,8,7,14
isxKWbKsjbVriw4AQ0gx,Strata de Verduras Asadas,180,26,11,4
sYt4H1sHlQSr8qZ4Qhzb,Sopa de Fideos de Pollo con Jengibre al Estilo Ramen,180,23,19,1
HiXKWZsSWBNbLMLPUMBJ,Muffins de Calabacín Altos en Fibra,185,28,5,6
lgOm2YyBbEx0ryzxwHPR,Pan Plano de Espelta Mediterráneo,185,26,8,6
1cpDnzbgFUIrvSUgSpvv,"Batido de Banana, Mantequilla de Cacahuate y Chocolate con Leche",190,19,11,11
6kaqFzIepc4fdu2eFd4g,Frittata Rápida de Salchicha y Albahaca Fresca,190,6,21,8
8hbaBFD7udwLu3r0gkq1,Huevos Benedict con Salsa Holandesa Sedosa,190,17,14,7
8mXm35XzTkK6xl0gP0kv,Muffins de Manzana y Especias Bajos en Carbohidratos,190,9,7,16
C0ipjXUIzxryGvjO2kkc,Mix de Snack Energético,190,19,4,12
YosqnFCek52cnxcNhiIG,Lomo de Cerdo Asado con Hierbas y Mostaza,190,2,22,10
jMUtru09fatXU9cPH1Nm,"Huevo al Horno con Aguacate, Tomate y Ensalada de Cítricos",190,11,8,8
lfR3AC9fQ73L9p2t0T4K,Parfait de Yogur con Arándanos y Limón,190,21,19,4
mlfbDzJhtojncXPDRjJT,Pastel de Carne con Hierbas y Ajo Económico,190,9,20,7
uLW9xTLZuKcul0C3tP5s,Chili de Verduras del Jardín y Frijoles Blancos,190,29,10,4
11ZHT1rkXXetn52X8yIu,Nuevas Hormigas en un Tronco,195,16,6,14
4q9ene5huycoZ6svxGeZ,Salteado de Pollo con Guisantes de Nieve y Pimiento,200,10,27,5
ARmjhnuTVYZIiDRC7IDR,Frittatas Individuales de Huevo y Verduras en Instant Pot,200,15,16,8
H1MjLa2lXyjxiDKjlY4C,Avena con Quinoa,200,30,9,6
In1iUEfdmWe9yAEAixlF,Pastel de Taza de Chocolate y Nuez,200,22,6,12
J5BHmoFE3yPz7SB5Qurp,Ensalada Inspirada en Nicoise,200,7,14,13
PNU7rPxCAjubWgjzomMk,Ensalada de Pasta con Verduras y Pollo,200,24,15,5
a0R8aS4R9aelkbvZxdlD,Burrito de Desayuno con Huevo y Jamón,200,15,16,8
iit7U1KHSUwCF3aG0L6K,Strata Ligera y Esponjosa de Espinaca y Queso,200,12,15,10
mZWg6yYCwP0c1xpglbfi,Tomates Rellenos de Ensalada de Atún y Fundidos,200,7,15,13
vzqMiALN3dida2XY2Qbt,Granola Energética,200,8,5,17
yljgm4upokAAq9kWGTZM,Parfait de Yogur con Chocolate y Mantequilla de Cacahuate,200,15,13,11
DfeDC3W9Kj8zE0QiydGB,Quiche sin Corteza de Espinaca y Champiñones,205,16,20,7
xEJJWamiQxBOFYZKwvR4,Avena OK con Fresas y Almendras,205,33,5,6
Jqr6Din7U9ZYv35c5KQ6,Pastel de Carne Clásico,210,17,21,7
KRolPptcq7WoaQWuu5LO,Muffins de Arándanos y Almendra,210,27,6,9
Tmb9jXqhcH50pl91FhGV,Frasco de Yogur y Granola Just Peachy,210,29,18,3
UwibDJze2UCRC94ovavl,Chili de Pollo Económico,210,30,19,2
f12gOd5qV5WG1xVQGLjZ,Refresco de Leche de Almendra,210,14,8,14
ikyKQYLW3nFKXs2yDoV4,Hamburguesa de Quinoa y Frijoles Negros,210,34,11,4
DP92AgezDhOtRbxSQGxQ,Chili de Pavo Fácil,220,10,23,9
Iyo1JvxjHXSq4KPkXvrP,Ensalada de Garbanzo con Perejil y Limón,220,25,8,11
bDlVHtr1oPCuEgALECax,Alitas Picantes al Horno con Dip de Cilantro y Lima,220,17,25,5
fHk37XDQ4xNzHtid5xvT,Chili Rápido para Congelador en Instant Pot,220,22,20,7
jwpedS6yjHVkBnBhO3uq,Avena con Frutas del Bosque y Almendra,220,33,7,7
kVc4I8SMhXWtdduw0Fp5,Pastel de Carne de Pavo al Estilo Suroeste,220,15,20,8
n4ytyLLeQc1ViGvVxHNq,Rollito de Huevo sin Relleno,220,9,25,9
pnLitY1KgIWD8jWCWSm9,Satay de Pollo,220,10,27,7
AAyyGZPSCdcRNH8sfN5R,Pollo al Limón con Romero y Ajo,230,3,30,10
Dx7JZTtTLdMp0Kmg8DGw,Estofado de Cerdo al Horno con Batatas y Chalotas,230,22,18,7
eiWbrIkTgQqRkxukBCxP,Hash de Salchicha de Pollo Económico,230,29,11,8
sdnduHJcn63jenA7xXJ1,Tostada de Aguacate con Tocino de Pavo y Tomate,230,20,8,130
z2UyN3PbSaCxGdoQfyI0,Shakshuka Rápida,230,25,12,9
zYVwiAf3E3n2aXHXGvjB,Chili de Pavo y Verduras,230,27,20,5
MgMU1v3xSiyO2si5SKOv,"Sándwich Económico de Huevo, Jamón y Espinaca",234,24,16,10
X50HlQMa9Vrvicxg698Y,Sopa Vegetariana Thai de Champiñones en Instant Pot,240,35,12,7
Yjq2M2XUCa8BCrQTL9z6,Frittata de Espárragos y Bok Choy,240,5,18,16
i2B1pKTmoqLbNhHKqXo6,Panqueques de Almendra y Arándanos,240,16,13,16
rM9l9DJpttD1QwSfe143,Avena Mediterránea Salada,240,37,12,5
shIPw5IjgB4uwUjjD05N,Yogur Griego Estilo Tzatziki Salado,240,12,19,14
7Wd2tAcFZWcNbhjfeTMl,Tazón de Arroz Frito con Verduras Baja en Carbohidratos,250,11,25,12
EMoSJILMxFGLu0OVwiIr,Pasta de Kale Vegetariana,250,38,17,6
nfFL66oz78w2DaJvaZ9F,Tostadas de Huevo y Aguacate,250,26,12,12
1lJ2FGierMEEM8NGoGen,Avena Nocturna de Pastel de Calabaza,260,26,22,10
41VKWTsXYRVz1kMuTPRe,Shakshuka con Pimientos Rojos y Queso de Cabra,260,16,18,14
ACAW9nacnNOET8L5mC0V,Frascos de Huevo y Verduras en Microondas,260,3,20,18
NT7wKbR2PCoy3Xnl09hK,Cazuela Fácil de Pollo y Verduras,260,23,27,7
SqboklcNQvhgmvRMSXbj,Cazuela de Tostadas Francesas con Fresas y Queso Crema,260,27,11,12
bTRy59Axh9yfkTgLPsxs,Panqueques de Mijo con Puré de Lentejas,260,44,16,3
vlJml0Ju1o894xpdYhBe,Tazón de Desayuno con Batido,260,34,11,10
H2uGfrT6VJuuldhkzV6P,Galletas de Desayuno,270,33,11,12
o2ftZ6Jln2XjefWFFXpY,Crepes Salados,270,31,21,8
sVfjdu95xSV6y9FIgewG,Frascos de Sopa Instantánea Casera,270,32,10,11
Zz4HN6Ghi1Empf9ecUbt,Avena al Horno con Calabaza,280,43,10,8
fnqCad8oeoEfp12aVMjA,Pollo y Batatas en Olla de Cocción Lenta Económicas,280,29,28,5
jniDjO2Yc25GpbTPZHLm,Lentejas y Huevos Escalfados en Instant Pot,280,22,16,15
pShgOULLUl3bA3vsUdOx,Chili de Pavo y Tres Frijoles,280,33,20,7
tkMw4JHj4fiW94zEOmAP,Amantes de la Pizza para el Desayuno,280,37,10,12
y6s6cwnA4iHaeX7evVc0,Salteado Asiático de Tofu,280,37,15,9
8yvKuVQSncvdbddetpOY,Batido de Pastel de Calabaza,285,29,29,7
TicHozOup025h3Co00h1,Tostadas Francesas de Manzana y Nuez,285,34,14,11
k18AMn5DDxdRabISDJSM,Tostadas Francesas de Manzana y Nuez (Pan de Nube),290,13,12,22
oNWA3NArf2iTs8N2g5Qc,Chili de Res Fácil,290,34,22,8
oPcGBUxuYMrLPC4w4hvR,Avena Nocturna de Canela y Vainilla Francesa,290,47,14,8
wXSKFz8J3aC3E9pEgBpi,"Huevos Rancheros con Frijoles Pinto, Arroz Integral y Salchicha de Pollo",290,31,22,9
E5wRnjWpZVFZ6yho9yeC,Pizza de Aguacate y Huevo,300,25,7,20
Xh8lf2265ONIqSGc4MW1,Chili sin Picar,300,26,26,11
i4tAIBMC6br0gnBvQgy0,Pechuga de Pollo Empanizada con Pacanas,300,3,37,15
qUIwaDqPTs9qymhJlkRP,Huevos Rancheros Blancos,300,30,21,10
tj7fE01wHgQOd6pc71Lh,Nachos para Tailgate,300,32,25,8
RqagKElkHtJsUJsOGhqi,Pita Mediterránea de Pollo,310,25,26,13
tFzGsAjRjjPvQuQPYmDc,Tostadas de Pollo Económicas,310,26,29,10
Hio5Fv3dgkpv8iEpZ45D,Tazones de Ensalada de Atún con Aguacate,320,11,22,23
0rseZYAmXzFoMQM9kH9Q,Batido de Té Verde y Arándanos,330,27,30,13
HUrCgx4ZDMcNjczai7tu,Tazón de Batido Tropical,330,44,18,13
hs2rJc6sh0AJf3pF2rsG,"Pollo, Judías Verdes y Papas en Bandeja",330,19,25,17
sHWicOcf5Pi1PN4sONeR,Huevos Ahogados en Salsa Verde,330,27,12,21
IbprBXXW0AEFNpIG3Hdw,Burrito de Frijol Rápido,340,45,11,15
NF8Bs5BViMOcoYUP9ojR,"Tazón BBQ Ama tus Sobras""""",340,38,37,6
zol8FbtDLWfPOIy2E7qa,Pizza de Desayuno,340,31,17,140
Y2l6SCo9p32MIJr5lDPA,Salmón y Judías Verdes al Horno en Bandeja,350,4,20,28
NrxZU3BrUDNQXdZpFDSm,Tazón de Batido Verde,360,51,19,15
xjJONwpgkxzenmYOEkkF,Sándwiches de Huevo Frito y Aguacate,360,36,15,18
LaXejNpVaOIPBz2rywS6,Avena Infundida con Jengibre,370,57,16,10
kJZ3hhWNPOlsdtwlDCDF,Hamburguesas de Pavo al Estilo Baja,370,37,25,13
Z5VlpLtYR90rh68qM0lR,Salteado de Carne y Brócoli,373,37,18,17
YnnOlsjdj5Cz8cKFMBqN,Parfait de Yogur con Pastel de Manzana,380,26,17,25
8SONnzbRS5PBUn7xQBxU,"Tazón de Mandarina, Verduras y Proteína",390,31,29,19
0x7jllbRfZYDZGDmwkLg,Taco de Huevo Frito al Sol y Aguacate,405,33,13,27
NprCojJoJlNW6j9Z9ZlY,Pollo y Waffles de Granos Enteros,410,44,35,10
4ptNtBTZm9A9r9M22mg7,Frittata de Salchicha Italiana,420,45,35,15
PSvxOwXZyJD7Sv0ziADN,Avena Salada con Queso,450,40,22,22
